{
  "catID: 1": [
    {
      "Suite": "BSA",
      "Test Suite": "PE",
      "Description": [
        "The Base System Architecture (BSA) Platform Design Document specifies a hardware system architecture that operating systems, hypervisors, and firmware can rely on.",
        "The SystemReady Devicetree band recommends compliance with BSA requirements.",
        "BSA PE tests verify BSA requirements on the Processing Element (PE).",
        "Failures may have only minor effects, or may prevent an OS to boot.",
        "https://github.com/ARM-software/sysarch-acs"
      ],
      "specName": "BSA",
      "rel Import. to main readiness": "Critical",
      "Waivable": "yes",
      "SRS scope": "Recommended",
      "FunctionID": 9,
      "Main Readiness Grouping": "Physical readiness"
    }
  ],
  "catID: 2": [
    {
      "Suite": "BSA",
      "Test Suite": "GIC",
      "Description": [
        "The Base System Architecture (BSA) Platform Design Document specifies a hardware system architecture that operating systems, hypervisors, and firmware can rely on.",
        "The SystemReady Devicetree band recommends compliance with BSA requirements.",
        "BSA GIC tests verify BSA requirements on the Generic Interrupt Controller (GIC).",
        "The GIC delivers interrupts to the Processing Elements (PEs).",
        "Failures may have only minor effects, or may prevent an OS to boot.",
        "https://github.com/ARM-software/sysarch-acs"
      ],
      "specName": "BSA",
      "rel Import. to main readiness": "Critical",
      "Waivable": "yes",
      "SRS scope": "Recommended",
      "FunctionID": 9,
      "Main Readiness Grouping": "Physical readiness"
    }
  ],
  "catID: 3": [
    {
      "Suite": "BSA",
      "Test Suite": "SMMU",
      "Description": [
        "The Base System Architecture (BSA) Platform Design Document specifies a hardware system architecture that operating systems, hypervisors, and firmware can rely on.",
        "The SystemReady Devicetree band recommends compliance with BSA requirements.",
        "BSA SMMU tests verify BSA requirements on the System Memory Management Unit (SMMU).",
        "An SMMU translates addresses from devices capable of Direct Memory Access (DMA).",
        "Failures may have only minor effects, or may prevent an OS to boot.",
        "https://github.com/ARM-software/sysarch-acs"
      ],
      "specName": "BSA",
      "rel Import. to main readiness": "Critical",
      "Waivable": "yes",
      "SRS scope": "Recommended",
      "FunctionID": 9,
      "Main Readiness Grouping": "Physical readiness"
    }
  ],
  "catID: 4": [
    {
      "Suite": "BSA",
      "Test Suite": "PCIe",
      "Description": [
        "The Base System Architecture (BSA) Platform Design Document specifies a hardware system architecture that operating systems, hypervisors, and firmware can rely on.",
        "The SystemReady Devicetree band recommends compliance with BSA requirements.",
        "BSA PCIe tests verify BSA requirements on PCI Express (PCIe) integration.",
        "Failures may have only minor effects, or may prevent an OS to boot.",
        "https://github.com/ARM-software/sysarch-acs"
      ],
      "specName": "BSA",
      "rel Import. to main readiness": "Minor",
      "Waivable": "yes",
      "SRS scope": "Recommended",
      "FunctionID": 9,
      "Main Readiness Grouping": "Physical readiness"
    }
  ],
  "catID: 5": [
    {
      "Suite": "BSA",
      "Test Suite": "Timer",
      "Description": [
        "The Base System Architecture (BSA) Platform Design Document specifies a hardware system architecture that operating systems, hypervisors, and firmware can rely on.",
        "The SystemReady Devicetree band recommends compliance with BSA requirements.",
        "BSA Timer tests verify BSA requirements on the clock and timer subsystem.",
        "Failures may have only minor effects, or may prevent an OS to boot.",
        "https://github.com/ARM-software/sysarch-acs"
      ],
      "specName": "BSA",
      "rel Import. to main readiness": "Minor",
      "Waivable": "yes",
      "SRS scope": "Recommended",
      "FunctionID": 9,
      "Main Readiness Grouping": "Physical readiness"
    }
  ],
  "catID: 6": [
    {
      "Suite": "BSA",
      "Test Suite": "Peripheral",
      "Description": [
        "The Base System Architecture (BSA) Platform Design Document specifies a hardware system architecture that operating systems, hypervisors, and firmware can rely on.",
        "The SystemReady Devicetree band recommends compliance with BSA requirements.",
        "BSA Peripheral tests verify BSA requirements on the peripheral subsystems (USB, SATA, UART).",
        "Failures may have only minor effects, or may prevent an OS to boot.",
        "https://github.com/ARM-software/sysarch-acs"
      ],
      "specName": "BSA",
      "rel Import. to main readiness": "Minor",
      "Waivable": "yes",
      "SRS scope": "Recommended",
      "FunctionID": 9,
      "Main Readiness Grouping": "Physical readiness"
    }
  ],
  "catID: 7": [
    {
      "Suite": "BSA",
      "Test Suite": "Watchdog",
      "Description": [
        "The Base System Architecture (BSA) Platform Design Document specifies a hardware system architecture that operating systems, hypervisors, and firmware can rely on.",
        "The SystemReady Devicetree band recommends compliance with BSA requirements.",
        "BSA Watchdog tests verify BSA requirements on the Generic Watchdog.",
	"Failures are not expected to prevent an OS from booting.",
        "https://github.com/ARM-software/sysarch-acs"
      ],
      "specName": "BSA",
      "rel Import. to main readiness": "Minor",
      "Waivable": "yes",
      "SRS scope": "Recommended",
      "FunctionID": 9,
      "Main Readiness Grouping": "Physical readiness"
    }
  ],
  "catID: 8": [
    {
      "Suite": "BSA",
      "Test Suite": "POWER_WAKEUP",
      "Description": [
        "The Base System Architecture (BSA) Platform Design Document specifies a hardware system architecture that operating systems, hypervisors, and firmware can rely on.",
        "The SystemReady Devicetree band recommends compliance with BSA requirements.",
        "BSA POWER_WAKEUP tests verify BSA requirements on the wakeup and power state semantics.",
	"Failures are not expected to prevent an OS from booting.",
        "https://github.com/ARM-software/sysarch-acs"
      ],
      "specName": "BSA",
      "rel Import. to main readiness": "Minor",
      "Waivable": "yes",
      "SRS scope": "Recommended",
      "FunctionID": 9,
      "Main Readiness Grouping": "Physical readiness"
    }
  ],
  "catID: 9": [
    {
      "Suite": "BSA",
      "Test Suite": "MEM_MAP",
      "Description": [
        "The Base System Architecture (BSA) Platform Design Document specifies a hardware system architecture that operating systems, hypervisors, and firmware can rely on.",
        "The SystemReady Devicetree band recommends compliance with BSA requirements.",
        "BSA MEM_MAP tests verify BSA requirements on the system's memory map.",
        "Failures may have only minor effects, or may prevent an OS to boot.",
        "https://github.com/ARM-software/sysarch-acs"
      ],
      "specName": "BSA",
      "rel Import. to main readiness": "Minor",
      "Waivable": "yes",
      "SRS scope": "Recommended",
      "FunctionID": 9,
      "Main Readiness Grouping": "Physical readiness"
    }
  ],
  "catID: 10": [
    {
      "Suite": "FWTS",
      "Test Suite": "uefivarinfo",
      "Description": [
        "The EBBR specification defines a subset of UEFI provided to an OS.",
        "The Firmware Test Suite (FWTS) is a test suite that performs sanity checks on firmware.",
	"The uefivarinfo FWTS tests verify requirements on UEFI Variables services.",
	"Failures are not expected to prevent an OS from booting.",
        "https://wiki.ubuntu.com/FirmwareTestSuite"
      ],
      "specName": "EBBR",
      "rel Import. to main readiness": "Critical",
      "Waivable": "no",
      "SRS scope": "Required",
      "FunctionID": 2,
      "Main Readiness Grouping": "maintenance readiness"
    }
  ],
  "catID: 11": [
    {
      "Suite": "FWTS",
      "Test Suite": "uefirtmisc",
      "Description": [
        "The EBBR specification defines a subset of UEFI provided to an OS.",
        "The Firmware Test Suite (FWTS) is a test suite that performs sanity checks on firmware.",
	"The uefirtmisc FWTS tests verify requirements on miscellaneous UEFI Runtime services.",
	"This comprises monotonic counter and capsule services.",
	"Failures may have only minor effects, or may prevent firmware update.",
        "https://wiki.ubuntu.com/FirmwareTestSuite"
      ],
      "specName": "EBBR",
      "rel Import. to main readiness": "Critical",
      "Waivable": "no",
      "SRS scope": "Required",
      "FunctionID": 6,
      "Main Readiness Grouping": "Misc readiness"
    }
  ],
  "catID: 12": [
    {
      "Suite": "FWTS",
      "Test Suite": "esrt",
      "Description": [
        "The EBBR specification defines a subset of UEFI provided to an OS.",
        "The Firmware Test Suite (FWTS) is a test suite that performs sanity checks on firmware.",
	"The esrt FWTS tests verify requirements on the EFI System Resource Table (ESRT).",
	"Failures may have only minor effects, or may prevent firmware update.",
        "https://wiki.ubuntu.com/FirmwareTestSuite"
      ],
      "specName": "EBBR",
      "rel Import. to main readiness": "Critical",
      "Waivable": "no",
      "SRS scope": "Required",
      "FunctionID": 2,
      "Main Readiness Grouping": "maintenance readiness"
    }
  ],
  "catID: 13": [
    {
      "Suite": "FWTS",
      "Test Suite": "uefirttime",
      "Description": [
        "The EBBR specification defines a subset of UEFI provided to an OS.",
        "The Firmware Test Suite (FWTS) is a test suite that performs sanity checks on firmware.",